{
  "action": {
    "changed_dimension": "counterparty_breadth_x_parent_size_quantile",
    "falsifiable_test": {
      "dataset_scope": "next_round_training_and_observation_only",
      "expected_observation": "At least one variant adds supported cells without duplicating its parent panel.",
      "reject_condition": "All variants are not evaluable, split-unstable, direction-incoherent, or exactly redundant."
    },
    "proposal": "Explore 16 controlled structures over counterparty_breadth_x_parent_size_quantile without a blind window grid.",
    "target_family_id": "market_microstructure",
    "type": "generate_variants"
  },
  "campaign_id": "sfm_stream_002",
  "experience_id": "experience_sfm_stream_002_round_001_trade_pair_parent_size_mismatch_001",
  "fact": {
    "evidence": [
      {
        "metric_path": "selection.cells.status.supported_count",
        "observed_value": 79,
        "portrait_id": "trade_pair_parent_size_mismatch_equal_weight_v1__market_microstructure_l4_v1"
      }
    ],
    "statement": "同笔成交的主动母单与被动母单容量错配以及扫单广度能否刻画主动方信息优势？: supported=79, promising=5, unsupported=0, not_evaluable=12 at factor×event×universe×label granularity; no holdout result was used."
  },
  "family_id": "market_microstructure",
  "generated_batch_ids": [
    "market_microstructure_round_002_wide_search"
  ],
  "interpretation": {
    "falsifiable_by": "Reject the next mechanism branch if no variant clears the same frozen split, coverage, magnitude and directional-coherence gates.",
    "statement": "The mechanism has repeatable pre-holdout cells and should be expanded structurally."
  },
  "kind": "experience_record",
  "schema_version": 1,
  "source_portrait_ids": [
    "trade_pair_parent_size_mismatch_volume_weighted_v1__market_microstructure_l4_v1",
    "trade_pair_parent_size_mismatch_equal_weight_v1__market_microstructure_l4_v1"
  ],
  "status": "proposed"
}
